models/.ipynb_checkpoints/results-checkpoint.json

{
    "LogisticRegression": {
        "train": {
            "accuracy": 0.7542147293700089,
            "precision": 0.5241228070175439,
            "recall": 0.7993311036789298,
            "f1": 0.633112582781457,
            "roc_auc": 0.7686269044964698,
            "mcc": 0.48326638141368616,
            "confusion_matrix": [
                [
                    611,
                    217
                ],
                [
                    60,
                    239
                ]
            ]
        },
        "evaluate": {
            "accuracy": 0.7402413058907026,
            "precision": 0.506872852233677,
            "recall": 0.7887700534759359,
            "f1": 0.6171548117154811,
            "roc_auc": 0.8422279056550156,
            "mcc": 0.45868702145058066,
            "confusion_matrix": [
                [
                    748,
                    287
                ],
                [
                    79,
                    295
                ]
            ]
        }
    },
    "DecisionTree": {
        "train": {
            "accuracy": 0.748890860692103,
            "precision": 0.5176991150442478,
            "recall": 0.782608695652174,
            "f1": 0.6231691078561917,
            "roc_auc": 0.7596618357487922,
            "mcc": 0.46780814337890414,
            "confusion_matrix": [
                [
                    610,
                    218
                ],
                [
                    65,
                    234
                ]
            ]
        },
        "evaluate": {
            "accuracy": 0.7388218594748048,
            "precision": 0.5053003533568905,
            "recall": 0.7647058823529411,
            "f1": 0.6085106382978723,
            "roc_auc": 0.8268852204913587,
            "mcc": 0.4451068605783582,
            "confusion_matrix": [
                [
                    755,
                    280
                ],
                [
                    88,
                    286
                ]
            ]
        }
    }
}

README.md

## Logistic Regression  

Logistic Regression achieved strong recall (0.789) among linear models and a high ROC-AUC (0.842), indicating good class separability. Although precision (0.507) is moderate, the model effectively identifies churn customers. It serves as a strong baseline model.

## Decision Tree  

The Decision Tree model achieved accuracy (0.739) similar to Logistic Regression but slightly lower MCC (0.445), indicating higher variance. While it captures nonlinear patterns, it is more prone to overfitting.